{
  "$schema": "./schema.json",
  "writingStyle": "showcase",
  "theme": "tokyo-night",
  "language": "en",
  "standards": {
    "a11yCompliance": "wcag22-aa",
    "spdxLicense": "Apache-2.0",
    "targetRegistry": "github",
    "generateCitationCff": false,
    "enableAllContributors": false,
    "openSsfBadges": true
  },
  "badges": {
    "style": "for-the-badge",
    "showBuild": true,
    "showCoverage": true,
    "showLicense": true,
    "custom": []
  },
  "sections": {
    "hero": true,
    "architectureDiagram": true,
    "featureGrid": true,
    "directoryTree": true,
    "techStackMatrix": true,
    "envVariablesTable": true,
    "apiReference": true,
    "troubleshooting": true,
    "allContributors": false
  },
  "beautify": {
    "centerHeader": true,
    "enableCollapsible": true,
    "directoryDepth": 3,
    "dualThemeBanner": true
  }
}
